fedora - tcpdump
================

- DNS Query for www.stevens.edu (Destination is 155.246.21.100)
05:46:02.990267 IP 172.31.25.24.34476 > 172.31.0.2.domain: 46242+ A? stevens.edu. (29)
05:46:02.990279 IP 172.31.25.24.34476 > 172.31.0.2.domain: 25294+ AAAA? stevens.edu. (29)
05:46:03.000948 IP 172.31.0.2.domain > 172.31.25.24.34476: 46242 1/0/0 A 155.246.21.100 (45)
05:46:03.070900 IP 172.31.0.2.domain > 172.31.25.24.34476: 25294 0/1/0 (100)

- Sending Traceroute Packets to Destination Host (155.246.21.100)
05:46:03.071141 IP 172.31.25.24.43675 > 155.246.21.100.traceroute: UDP, length 32
(15 Additional Packets Following)

- 6th Hop Response, and the UDP to the Destination Host
05:46:03.071883 IP 100.65.12.33 > 172.31.25.24: ICMP time exceeded in-transit, length 36
05:46:03.071940 IP 172.31.25.24.54952 > 155.246.21.100.33450: UDP, length 32

- 6th Hop 
05:46:03.072294 IP 100.65.12.49 > 172.31.25.24: ICMP time exceeded in-transit, length 36
(UDP to Destination Followed)

- 6th Hop 
05:46:03.073429 IP 100.65.12.65 > 172.31.25.24: ICMP time exceeded in-transit, length 36
(UDP to Destination Followed)

- 7th Hop
05:46:03.073934 IP 52.93.28.129 > 172.31.25.24: ICMP time exceeded in-transit, length 36
(UDP to Destination Followed)

- 7th Hop 
05:46:03.074431 IP 52.93.28.93 > 172.31.25.24: ICMP time exceeded in-transit, length 36
(UDP to Destination Followed)

- 7th Hop 
05:46:03.075537 IP 52.93.28.133 > 172.31.25.24: ICMP time exceeded in-transit, length 36
(UDP to Destination Followed)

- 2nd Hop
05:46:03.082703 IP 100.66.8.106 > 172.31.25.24: ICMP time exceeded in-transit, length 36
(UDP to Destination Followed)

- 3rd Hop
05:46:03.082995 IP 100.66.10.234 > 172.31.25.24: ICMP time exceeded in-transit, length 36
(UDP to Destination Followed)

- 2nd Hop 
05:46:03.083610 IP 100.66.8.244 > 172.31.25.24: ICMP time exceeded in-transit, length 36
(UDP to Destination Followed)

- 5th Hop
05:46:03.084717 IP 100.66.5.131 > 172.31.25.24: ICMP time exceeded in-transit, length 36
(UDP to Destination Followed)

- 3rd Hop 
05:46:03.086700 IP 100.66.14.38 > 172.31.25.24: ICMP time exceeded in-transit, length 36
(UDP to Destination Followed)

- 1st Hop
05:46:03.087152 IP 216.182.226.110 > 172.31.25.24: ICMP time exceeded in-transit, length 36

- 4th Hop
05:46:03.087216 IP 100.66.7.157 > 172.31.25.24: ICMP time exceeded in-transit, length 36
(UDP to Destination Followed x2)

- 2nd Hop 
05:46:03.087401 IP 100.66.8.228 > 172.31.25.24: ICMP time exceeded in-transit, length 36
(UDP to Destination Followed)

- 1st Hop 
05:46:03.088388 IP 216.182.226.106 > 172.31.25.24: ICMP time exceeded in-transit, length 36
(UDP to Destination Followed)

- 4th Hop 
05:46:03.088771 IP 100.66.6.239 > 172.31.25.24: ICMP time exceeded in-transit, length 36
(UDP to Destination Followed)

- 9th Hop
05:46:03.090487 IP 100.91.129.21 > 172.31.25.24: ICMP time exceeded in-transit, length 36
(UDP to Destination Followed)

- 9th Hop 
05:46:03.090779 IP 100.91.129.19 > 172.31.25.24: ICMP time exceeded in-transit, length 36
(UDP to Destination Followed)

- 4th Hop 
05:46:03.091232 IP 100.66.6.135 > 172.31.25.24: ICMP time exceeded in-transit, length 36
(UDP to Destination Followed)

- 5th Hop 
05:46:03.092269 IP 100.66.5.129 > 172.31.25.24: ICMP time exceeded in-transit, length 36

- 5th Hop 
05:46:03.092275 IP 100.66.5.149 > 172.31.25.24: ICMP time exceeded in-transit, length 36
(UDP to Destination Followed x2)

- 9th Hop 
05:46:03.092703 IP 100.91.129.103 > 172.31.25.24: ICMP time exceeded in-transit, length 36
(UDP to Destination Followed)

- 3rd Hop 
05:46:03.092767 IP 100.66.10.170 > 172.31.25.24: ICMP time exceeded in-transit, length 36
(UDP to Destination Followed)

- 1st Hop 
05:46:03.093003 IP 216.182.226.6 > 172.31.25.24: ICMP time exceeded in-transit, length 36

- DNS Pointer - Reverse Lookup of 1st Hop
05:46:03.093122 IP 172.31.25.24.51229 > 172.31.0.2.domain: 26467+ PTR? 6.226.182.216.in-addr.arpa. (44)

- 11th Hop
05:46:03.094713 IP 52.93.1.90 > 172.31.25.24: ICMP time exceeded in-transit, length 36

- 11th Hop 
05:46:03.095209 IP 52.93.1.86 > 172.31.25.24: ICMP time exceeded in-transit, length 36

- 11th Hop 
05:46:03.097373 IP 52.93.1.76 > 172.31.25.24: ICMP time exceeded in-transit, length 36

- DNS Non-Existent Domain for 1st Hop
05:46:03.097564 IP 172.31.0.2.domain > 172.31.25.24.51229: 26467 NXDomain 0/1/0 (115)

- 12th Hop (Exact IP x2)
05:46:03.097764 IP 198.32.160.76 > 172.31.25.24: ICMP time exceeded in-transit, length 76

- DNS Pointer - Reverse Lookup of 1st Hop 
05:46:03.098906 IP 172.31.25.24.35016 > 172.31.0.2.domain: 49882+ PTR? 106.226.182.216.in-addr.arpa. (46)

- 13th Hop
05:46:03.099159 IP 130.156.251.106 > 172.31.25.24: ICMP time exceeded in-transit, length 36

- 12th Hop 
05:46:03.099425 IP 198.32.160.76 > 172.31.25.24: ICMP time exceeded in-transit, length 76

- 10th Hop
05:46:03.099454 IP 52.93.1.27 > 172.31.25.24: ICMP time exceeded in-transit, length 148

- 13th Hop (Exact IP x2)
05:46:03.099485 IP 130.156.251.106 > 172.31.25.24: ICMP time exceeded in-transit, length 36

- DNS Non-Existent Domain for 1st Hop 
05:46:03.100694 IP 172.31.0.2.domain > 172.31.25.24.35016: 49882 NXDomain 0/1/0 (117)

- DNS Pointer - Reverse Lookup of 1st Hop 
05:46:03.100902 IP 172.31.25.24.42375 > 172.31.0.2.domain: 61743+ PTR? 110.226.182.216.in-addr.arpa. (46)

- 10th Hop 
05:46:03.101754 IP 52.93.1.13 > 172.31.25.24: ICMP time exceeded in-transit, length 148

- 10th Hop 
05:46:03.102773 IP 52.93.1.51 > 172.31.25.24: ICMP time exceeded in-transit, length 148

- DNS Non-Existent Domain for 1st Hop
05:46:03.103361 IP 172.31.0.2.domain > 172.31.25.24.42375: 61743 NXDomain 0/1/0 (117) 

- DNS Pointer - Reverse Lookup of 2nd Hop
05:46:03.103570 IP 172.31.25.24.44586 > 172.31.0.2.domain: 43774+ PTR? 228.8.66.100.in-addr.arpa. (43) 

- DNS Non-Existent Domain for 2nd Hop
05:46:03.105131 IP 172.31.0.2.domain > 172.31.25.24.44586: 43774 NXDomain 0/1/0 (102) 

- DNS Pointer - Reverse Lookup of 2nd Hop
05:46:03.105330 IP 172.31.25.24.48482 > 172.31.0.2.domain: 36907+ PTR? 244.8.66.100.in-addr.arpa. (43) 

- DNS Non-Existent Domain for 2nd Hop
05:46:03.106929 IP 172.31.0.2.domain > 172.31.25.24.48482: 36907 NXDomain 0/1/0 (102) 

- DNS Pointer - Reverse Lookup of 2nd Hop
05:46:03.107157 IP 172.31.25.24.40989 > 172.31.0.2.domain: 29913+ PTR? 106.8.66.100.in-addr.arpa. (43) 

- DNS Non-Existent Domain for 2nd Hop
05:46:03.108844 IP 172.31.0.2.domain > 172.31.25.24.40989: 29913 NXDomain 0/1/0 (102) 

- DNS Pointer - Reverse Lookup of 3rd Hop
05:46:03.109064 IP 172.31.25.24.60279 > 172.31.0.2.domain: 17811+ PTR? 234.10.66.100.in-addr.arpa. (44) 

- DNS Non-Existent Domain for 3rd Hop
05:46:03.110643 IP 172.31.0.2.domain > 172.31.25.24.60279: 17811 NXDomain 0/1/0 (103) 

- DNS Pointer - Reverse Lookup of 3rd Hop
05:46:03.110844 IP 172.31.25.24.57232 > 172.31.0.2.domain: 5253+ PTR? 38.14.66.100.in-addr.arpa. (43) 

- DNS Non-Existent Domain for 3rd Hop
05:46:03.112736 IP 172.31.0.2.domain > 172.31.25.24.57232: 5253 NXDomain 0/1/0 (102) 

- DNS Pointer - Reverse Lookup of 3rd Hop
05:46:03.112942 IP 172.31.25.24.39516 > 172.31.0.2.domain: 57480+ PTR? 170.10.66.100.in-addr.arpa. (44) 

- DNS Non-Existent Domain for 3rd Hop
05:46:03.114970 IP 172.31.0.2.domain > 172.31.25.24.39516: 57480 NXDomain 0/1/0 (103) 

- DNS Pointer - Reverse Lookup of 4th Hop
05:46:03.115186 IP 172.31.25.24.51620 > 172.31.0.2.domain: 57387+ PTR? 135.6.66.100.in-addr.arpa. (43) 

- DNS Non-Existent Domain for 4th Hop
05:46:03.116769 IP 172.31.0.2.domain > 172.31.25.24.51620: 57387 NXDomain 0/1/0 (102) 

- DNS Pointer - Reverse Lookup of 4th Hop
05:46:03.116968 IP 172.31.25.24.35252 > 172.31.0.2.domain: 14629+ PTR? 239.6.66.100.in-addr.arpa. (43) 

- DNS Non-Existent Domain for 4th Hop
05:46:03.118800 IP 172.31.0.2.domain > 172.31.25.24.35252: 14629 NXDomain 0/1/0 (102) 

- DNS Pointer - Reverse Lookup of 4th Hop
05:46:03.119020 IP 172.31.25.24.56005 > 172.31.0.2.domain: 18547+ PTR? 157.7.66.100.in-addr.arpa. (43) 

- DNS Non-Existent Domain for 4th Hop
05:46:03.120228 IP 172.31.0.2.domain > 172.31.25.24.56005: 18547 NXDomain 0/1/0 (102) 

- DNS Pointer - Reverse Lookup of 5th Hop
05:46:03.120429 IP 172.31.25.24.52740 > 172.31.0.2.domain: 24617+ PTR? 131.5.66.100.in-addr.arpa. (43) 

- DNS Non-Existent Domain for 5th Hop
05:46:03.122689 IP 172.31.0.2.domain > 172.31.25.24.52740: 24617 NXDomain 0/1/0 (102) 

- DNS Pointer - Reverse Lookup of 5th Hop
05:46:03.122884 IP 172.31.25.24.44685 > 172.31.0.2.domain: 32211+ PTR? 129.5.66.100.in-addr.arpa. (43) 

- DNS Non-Existent Domain for 5th Hop
05:46:03.134055 IP 172.31.0.2.domain > 172.31.25.24.44685: 32211 NXDomain 0/1/0 (102) 

- DNS Pointer - Reverse Lookup of 5th Hop
05:46:03.134255 IP 172.31.25.24.58704 > 172.31.0.2.domain: 24732+ PTR? 149.5.66.100.in-addr.arpa. (43) 

- DNS Non-Existent Domain for 5th Hop
05:46:03.135698 IP 172.31.0.2.domain > 172.31.25.24.58704: 24732 NXDomain 0/1/0 (102) 

- DNS Pointer - Reverse Lookup of 6th Hop
05:46:03.135892 IP 172.31.25.24.43436 > 172.31.0.2.domain: 23579+ PTR? 33.12.65.100.in-addr.arpa. (43) 

- DNS Non-Existent Domain for 6th Hop
05:46:03.137377 IP 172.31.0.2.domain > 172.31.25.24.43436: 23579 NXDomain 0/1/0 (102) 

- DNS Pointer - Reverse Lookup of 6th Hop
05:46:03.137572 IP 172.31.25.24.32881 > 172.31.0.2.domain: 14632+ PTR? 49.12.65.100.in-addr.arpa. (43) 

- DNS Non-Existent Domain for 6th Hop
05:46:03.139052 IP 172.31.0.2.domain > 172.31.25.24.32881: 14632 NXDomain 0/1/0 (102) 

- DNS Pointer - Reverse Lookup of 6th Hop
05:46:03.139252 IP 172.31.25.24.41013 > 172.31.0.2.domain: 25664+ PTR? 65.12.65.100.in-addr.arpa. (43) 

- DNS Non-Existent Domain for 6th Hop
05:46:03.140782 IP 172.31.0.2.domain > 172.31.25.24.41013: 25664 NXDomain 0/1/0 (102) 

- DNS Pointer - Reverse Lookup of 7th Hop
05:46:03.140974 IP 172.31.25.24.49690 > 172.31.0.2.domain: 37620+ PTR? 129.28.93.52.in-addr.arpa. (43) 

- DNS Non-Existent Domain for 7th Hop
05:46:03.143299 IP 172.31.0.2.domain > 172.31.25.24.49690: 37620 NXDomain 0/1/0 (114) 

- DNS Pointer - Reverse Lookup of 7th Hop
05:46:03.143493 IP 172.31.25.24.36194 > 172.31.0.2.domain: 61969+ PTR? 93.28.93.52.in-addr.arpa. (42) 

- DNS Non-Existent Domain for 7th Hop
05:46:03.166187 IP 172.31.0.2.domain > 172.31.25.24.36194: 61969 NXDomain 0/1/0 (113) 

- DNS Pointer - Reverse Lookup of 7th Hop
05:46:03.166391 IP 172.31.25.24.49556 > 172.31.0.2.domain: 57232+ PTR? 133.28.93.52.in-addr.arpa. (43) 

- DNS Non-Existent Domain for 7th Hop
05:46:03.169094 IP 172.31.0.2.domain > 172.31.25.24.49556: 57232 NXDomain 0/1/0 (114) 

(UDP to Destination) 

- DNS Pointer - Reverse Lookup of 9th Hop
05:46:03.169421 IP 172.31.25.24.58866 > 172.31.0.2.domain: 47669+ PTR? 21.129.91.100.in-addr.arpa. (44) 

- DNS Non-Existent Domain for 9th Hop
05:46:03.171054 IP 172.31.0.2.domain > 172.31.25.24.58866: 47669 NXDomain 0/1/0 (103) 

- DNS Pointer - Reverse Lookup of 9th Hop
05:46:03.171249 IP 172.31.25.24.38406 > 172.31.0.2.domain: 48606+ PTR? 19.129.91.100.in-addr.arpa. (44) 

- DNS Non-Existent Domain for 9th Hop
05:46:03.172840 IP 172.31.0.2.domain > 172.31.25.24.38406: 48606 NXDomain 0/1/0 (103) 

- DNS Pointer - Reverse Lookup of 9th Hop
05:46:03.173060 IP 172.31.25.24.59369 > 172.31.0.2.domain: 39936+ PTR? 103.129.91.100.in-addr.arpa. (45) 

- DNS Non-Existent Domain for 9th Hop
05:46:03.174717 IP 172.31.0.2.domain > 172.31.25.24.59369: 39936 NXDomain 0/1/0 (104) 

- DNS Pointer - Reverse Lookup of 10th Hop
05:46:03.174910 IP 172.31.25.24.45232 > 172.31.0.2.domain: 23699+ PTR? 27.1.93.52.in-addr.arpa. (41) 

- 14th Hop
05:46:03.175939 IP 155.246.151.34 > 172.31.25.24: ICMP time exceeded in-transit, length 68 

- DNS Non-Existent Domain for 10th Hop
05:46:03.178062 IP 172.31.0.2.domain > 172.31.25.24.45232: 23699 NXDomain 0/1/0 (112) 

- DNS Pointer - Reverse Lookup of 10th Hop
05:46:03.178262 IP 172.31.25.24.36825 > 172.31.0.2.domain: 6004+ PTR? 13.1.93.52.in-addr.arpa. (41) 

- DNS Non-Existent Domain for 10th Hop
05:46:03.180785 IP 172.31.0.2.domain > 172.31.25.24.36825: 6004 NXDomain 0/1/0 (112) 

- DNS Pointer - Reverse Lookup of 10th Hop
05:46:03.180978 IP 172.31.25.24.45633 > 172.31.0.2.domain: 8464+ PTR? 51.1.93.52.in-addr.arpa. (41) 

- DNS Non-Existent Domain for 10th Hop
05:46:03.183372 IP 172.31.0.2.domain > 172.31.25.24.45633: 8464 NXDomain 0/1/0 (112) 

- DNS Pointer - Reverse Lookup of 11th Hop
05:46:03.183573 IP 172.31.25.24.34965 > 172.31.0.2.domain: 44046+ PTR? 90.1.93.52.in-addr.arpa. (41) 

- DNS Non-Existent Domain for 11th Hop
05:46:03.185671 IP 172.31.0.2.domain > 172.31.25.24.34965: 44046 NXDomain 0/1/0 (112) 

- DNS Pointer - Reverse Lookup of 11th Hop
05:46:03.185863 IP 172.31.25.24.53479 > 172.31.0.2.domain: 58729+ PTR? 86.1.93.52.in-addr.arpa. (41) 

- DNS Non-Existent Domain for 11th Hop
05:46:03.188416 IP 172.31.0.2.domain > 172.31.25.24.53479: 58729 NXDomain 0/1/0 (112) 

- DNS Pointer - Reverse Lookup of 11th Hop
05:46:03.188613 IP 172.31.25.24.40488 > 172.31.0.2.domain: 17234+ PTR? 76.1.93.52.in-addr.arpa. (41) 

- DNS Non-Existent Domain for 11th Hop
05:46:03.193575 IP 172.31.0.2.domain > 172.31.25.24.40488: 17234 NXDomain 0/1/0 (112) 

- DNS Pointer - Reverse Lookup of 12th Hop (and Resolution)
05:46:03.193774 IP 172.31.25.24.40962 > 172.31.0.2.domain: 54837+ PTR? 76.160.32.198.in-addr.arpa. (44) 
05:46:03.207651 IP 172.31.0.2.domain > 172.31.25.24.40962: 54837 1/0/0 PTR www.njedge.net. (72) 

- DNS Pointer - Reverse Lookup of 13th Hop
05:46:03.208109 IP 172.31.25.24.42861 > 172.31.0.2.domain: 18391+ PTR? 106.251.156.130.in-addr.arpa. (46) 

- DNS Non-Existent Domain for 13th Hop
05:46:03.210833 IP 172.31.0.2.domain > 172.31.25.24.42861: 18391 NXDomain 0/1/0 (116) 

(UDP to Destination x15)

- DNS Pointer - Reverse Lookup of 14th Hop
05:46:03.211598 IP 172.31.25.24.50037 > 172.31.0.2.domain: 42033+ PTR? 34.151.246.155.in-addr.arpa. (45) 

- 14th Hop
05:46:03.217540 IP 155.246.151.34 > 172.31.25.24: ICMP time exceeded in-transit, length 68 

- 14th Hop
05:46:03.217837 IP 155.246.151.34 > 172.31.25.24: ICMP time exceeded in-transit, length 68 

- 15th Hop
05:46:03.219073 IP 155.246.151.90 > 172.31.25.24: ICMP time exceeded in-transit, length 36 

- Unreachable 16th Hop (Probably Blocked by Firewall)
05:46:03.219096 IP 155.246.21.100 > 172.31.25.24: ICMP host 155.246.21.100 unreachable - admin prohibited, length 68 

- Unreachable 16th Hop (Probably Blocked by Firewall)
05:46:03.219190 IP 155.246.21.100 > 172.31.25.24: ICMP host 155.246.21.100 unreachable - admin prohibited, length 68 

- Unreachable 16th Hop (Probably Blocked by Firewall)
05:46:03.219192 IP 155.246.21.100 > 172.31.25.24: ICMP host 155.246.21.100 unreachable - admin prohibited, length 68 

- Unreachable 16th Hop (Probably Blocked by Firewall)
05:46:03.219194 IP 155.246.21.100 > 172.31.25.24: ICMP host 155.246.21.100 unreachable - admin prohibited, length 68 

- Unreachable 16th Hop (Probably Blocked by Firewall)
05:46:03.219196 IP 155.246.21.100 > 172.31.25.24: ICMP host 155.246.21.100 unreachable - admin prohibited, length 68 

- Unreachable 16th Hop (Probably Blocked by Firewall)
05:46:03.219198 IP 155.246.21.100 > 172.31.25.24: ICMP host 155.246.21.100 unreachable - admin prohibited, length 68 

- 15th Hop
05:46:03.219325 IP 155.246.151.90 > 172.31.25.24: ICMP time exceeded in-transit, length 36 

- 15th Hop
05:46:03.219327 IP 155.246.151.90 > 172.31.25.24: ICMP time exceeded in-transit, length 36 

- DNS Non-Existent Domain for 14th Hop
05:46:03.235901 IP 172.31.0.2.domain > 172.31.25.24.50037: 42033 NXDomain 0/1/0 (119) 

(UDP to Destination) 

- DNS Pointer - Reverse Lookup of 15th Hop
05:46:03.236238 IP 172.31.25.24.59301 > 172.31.0.2.domain: 40227+ PTR? 90.151.246.155.in-addr.arpa. (45) 

- DNS Non-Existent Domain for 15th Hop
05:46:03.246627 IP 172.31.0.2.domain > 172.31.25.24.59301: 40227 NXDomain 0/1/0 (119) 

- DNS Pointer - Reverse Lookup of 16th Hop (and Resolution)
05:46:03.246858 IP 172.31.25.24.33678 > 172.31.0.2.domain: 44089+ PTR? 100.21.246.155.in-addr.arpa. (45) 
05:46:03.330618 IP 172.31.0.2.domain > 172.31.25.24.33678: 44089 2/0/0 PTR stevens.edu., PTR redirect.stevens.edu. (93) 