05:46:03.100694 IP 172.31.0.2.domain > 172.31.25.24.35016: 49882 NXDomain 0/1/0 (117)
05:46:03.100902 IP 172.31.25.24.42375 > 172.31.0.2.domain: 61743+ PTR? 110.226.182.216.in-addr.arpa. (46)
05:46:03.101754 IP 52.93.1.13 > 172.31.25.24: ICMP time exceeded in-transit, length 148
05:46:03.102773 IP 52.93.1.51 > 172.31.25.24: ICMP time exceeded in-transit, length 148
05:46:03.103361 IP 172.31.0.2.domain > 172.31.25.24.42375: 61743 NXDomain 0/1/0 (117)
05:46:03.103570 IP 172.31.25.24.44586 > 172.31.0.2.domain: 43774+ PTR? 228.8.66.100.in-addr.arpa. (43)
05:46:03.105131 IP 172.31.0.2.domain > 172.31.25.24.44586: 43774 NXDomain 0/1/0 (102)
05:46:03.105330 IP 172.31.25.24.48482 > 172.31.0.2.domain: 36907+ PTR? 244.8.66.100.in-addr.arpa. (43)
05:46:03.106929 IP 172.31.0.2.domain > 172.31.25.24.48482: 36907 NXDomain 0/1/0 (102)
05:46:03.107157 IP 172.31.25.24.40989 > 172.31.0.2.domain: 29913+ PTR? 106.8.66.100.in-addr.arpa. (43)
05:46:03.108844 IP 172.31.0.2.domain > 172.31.25.24.40989: 29913 NXDomain 0/1/0 (102)
05:46:03.109064 IP 172.31.25.24.60279 > 172.31.0.2.domain: 17811+ PTR? 234.10.66.100.in-addr.arpa. (44)
05:46:03.110643 IP 172.31.0.2.domain > 172.31.25.24.60279: 17811 NXDomain 0/1/0 (103)
05:46:03.110844 IP 172.31.25.24.57232 > 172.31.0.2.domain: 5253+ PTR? 38.14.66.100.in-addr.arpa. (43)
05:46:03.112736 IP 172.31.0.2.domain > 172.31.25.24.57232: 5253 NXDomain 0/1/0 (102)
05:46:03.112942 IP 172.31.25.24.39516 > 172.31.0.2.domain: 57480+ PTR? 170.10.66.100.in-addr.arpa. (44)
05:46:03.114970 IP 172.31.0.2.domain > 172.31.25.24.39516: 57480 NXDomain 0/1/0 (103)
05:46:03.115186 IP 172.31.25.24.51620 > 172.31.0.2.domain: 57387+ PTR? 135.6.66.100.in-addr.arpa. (43)
05:46:03.116769 IP 172.31.0.2.domain > 172.31.25.24.51620: 57387 NXDomain 0/1/0 (102)
05:46:03.116968 IP 172.31.25.24.35252 > 172.31.0.2.domain: 14629+ PTR? 239.6.66.100.in-addr.arpa. (43)
05:46:03.118800 IP 172.31.0.2.domain > 172.31.25.24.35252: 14629 NXDomain 0/1/0 (102)
05:46:03.119020 IP 172.31.25.24.56005 > 172.31.0.2.domain: 18547+ PTR? 157.7.66.100.in-addr.arpa. (43)
05:46:03.120228 IP 172.31.0.2.domain > 172.31.25.24.56005: 18547 NXDomain 0/1/0 (102)
05:46:03.120429 IP 172.31.25.24.52740 > 172.31.0.2.domain: 24617+ PTR? 131.5.66.100.in-addr.arpa. (43)
05:46:03.122689 IP 172.31.0.2.domain > 172.31.25.24.52740: 24617 NXDomain 0/1/0 (102)
05:46:03.122884 IP 172.31.25.24.44685 > 172.31.0.2.domain: 32211+ PTR? 129.5.66.100.in-addr.arpa. (43)
05:46:03.134055 IP 172.31.0.2.domain > 172.31.25.24.44685: 32211 NXDomain 0/1/0 (102)
05:46:03.134255 IP 172.31.25.24.58704 > 172.31.0.2.domain: 24732+ PTR? 149.5.66.100.in-addr.arpa. (43)
05:46:03.135698 IP 172.31.0.2.domain > 172.31.25.24.58704: 24732 NXDomain 0/1/0 (102)
05:46:03.135892 IP 172.31.25.24.43436 > 172.31.0.2.domain: 23579+ PTR? 33.12.65.100.in-addr.arpa. (43)
05:46:03.137377 IP 172.31.0.2.domain > 172.31.25.24.43436: 23579 NXDomain 0/1/0 (102)
05:46:03.137572 IP 172.31.25.24.32881 > 172.31.0.2.domain: 14632+ PTR? 49.12.65.100.in-addr.arpa. (43)
05:46:03.139052 IP 172.31.0.2.domain > 172.31.25.24.32881: 14632 NXDomain 0/1/0 (102)
05:46:03.139252 IP 172.31.25.24.41013 > 172.31.0.2.domain: 25664+ PTR? 65.12.65.100.in-addr.arpa. (43)
05:46:03.140782 IP 172.31.0.2.domain > 172.31.25.24.41013: 25664 NXDomain 0/1/0 (102)
05:46:03.140974 IP 172.31.25.24.49690 > 172.31.0.2.domain: 37620+ PTR? 129.28.93.52.in-addr.arpa. (43)
05:46:03.143299 IP 172.31.0.2.domain > 172.31.25.24.49690: 37620 NXDomain 0/1/0 (114)
05:46:03.143493 IP 172.31.25.24.36194 > 172.31.0.2.domain: 61969+ PTR? 93.28.93.52.in-addr.arpa. (42)
05:46:03.166187 IP 172.31.0.2.domain > 172.31.25.24.36194: 61969 NXDomain 0/1/0 (113)
05:46:03.166391 IP 172.31.25.24.49556 > 172.31.0.2.domain: 57232+ PTR? 133.28.93.52.in-addr.arpa. (43)
05:46:03.169094 IP 172.31.0.2.domain > 172.31.25.24.49556: 57232 NXDomain 0/1/0 (114)
05:46:03.169276 IP 172.31.25.24.48078 > 155.246.21.100.33473: UDP, length 32
05:46:03.169421 IP 172.31.25.24.58866 > 172.31.0.2.domain: 47669+ PTR? 21.129.91.100.in-addr.arpa. (44)
05:46:03.171054 IP 172.31.0.2.domain > 172.31.25.24.58866: 47669 NXDomain 0/1/0 (103)
05:46:03.171249 IP 172.31.25.24.38406 > 172.31.0.2.domain: 48606+ PTR? 19.129.91.100.in-addr.arpa. (44)
05:46:03.172840 IP 172.31.0.2.domain > 172.31.25.24.38406: 48606 NXDomain 0/1/0 (103)
05:46:03.173060 IP 172.31.25.24.59369 > 172.31.0.2.domain: 39936+ PTR? 103.129.91.100.in-addr.arpa. (45)
05:46:03.174717 IP 172.31.0.2.domain > 172.31.25.24.59369: 39936 NXDomain 0/1/0 (104)
05:46:03.174910 IP 172.31.25.24.45232 > 172.31.0.2.domain: 23699+ PTR? 27.1.93.52.in-addr.arpa. (41)
05:46:03.175939 IP 155.246.151.34 > 172.31.25.24: ICMP time exceeded in-transit, length 68
05:46:03.178062 IP 172.31.0.2.domain > 172.31.25.24.45232: 23699 NXDomain 0/1/0 (112)
05:46:03.178262 IP 172.31.25.24.36825 > 172.31.0.2.domain: 6004+ PTR? 13.1.93.52.in-addr.arpa. (41)
05:46:03.180785 IP 172.31.0.2.domain > 172.31.25.24.36825: 6004 NXDomain 0/1/0 (112)
05:46:03.180978 IP 172.31.25.24.45633 > 172.31.0.2.domain: 8464+ PTR? 51.1.93.52.in-addr.arpa. (41)
05:46:03.183372 IP 172.31.0.2.domain > 172.31.25.24.45633: 8464 NXDomain 0/1/0 (112)
05:46:03.183573 IP 172.31.25.24.34965 > 172.31.0.2.domain: 44046+ PTR? 90.1.93.52.in-addr.arpa. (41)
05:46:03.185671 IP 172.31.0.2.domain > 172.31.25.24.34965: 44046 NXDomain 0/1/0 (112)
05:46:03.185863 IP 172.31.25.24.53479 > 172.31.0.2.domain: 58729+ PTR? 86.1.93.52.in-addr.arpa. (41)
05:46:03.188416 IP 172.31.0.2.domain > 172.31.25.24.53479: 58729 NXDomain 0/1/0 (112)
05:46:03.188613 IP 172.31.25.24.40488 > 172.31.0.2.domain: 17234+ PTR? 76.1.93.52.in-addr.arpa. (41)
05:46:03.193575 IP 172.31.0.2.domain > 172.31.25.24.40488: 17234 NXDomain 0/1/0 (112)
05:46:03.193774 IP 172.31.25.24.40962 > 172.31.0.2.domain: 54837+ PTR? 76.160.32.198.in-addr.arpa. (44)
05:46:03.207651 IP 172.31.0.2.domain > 172.31.25.24.40962: 54837 1/0/0 PTR www.njedge.net. (72)
05:46:03.208109 IP 172.31.25.24.42861 > 172.31.0.2.domain: 18391+ PTR? 106.251.156.130.in-addr.arpa. (46)
05:46:03.210833 IP 172.31.0.2.domain > 172.31.25.24.42861: 18391 NXDomain 0/1/0 (116)
05:46:03.211054 IP 172.31.25.24.52498 > 155.246.21.100.33474: UDP, length 32
05:46:03.211093 IP 172.31.25.24.51273 > 155.246.21.100.33475: UDP, length 32
05:46:03.211123 IP 172.31.25.24.33486 > 155.246.21.100.33476: UDP, length 32
05:46:03.211156 IP 172.31.25.24.59347 > 155.246.21.100.33477: UDP, length 32
05:46:03.211191 IP 172.31.25.24.56933 > 155.246.21.100.33478: UDP, length 32
05:46:03.211225 IP 172.31.25.24.60814 > 155.246.21.100.33479: UDP, length 32
05:46:03.211258 IP 172.31.25.24.35115 > 155.246.21.100.33480: UDP, length 32
05:46:03.211292 IP 172.31.25.24.47933 > 155.246.21.100.33481: UDP, length 32
05:46:03.211326 IP 172.31.25.24.37981 > 155.246.21.100.33482: UDP, length 32
05:46:03.211359 IP 172.31.25.24.33367 > 155.246.21.100.33483: UDP, length 32
05:46:03.211391 IP 172.31.25.24.58217 > 155.246.21.100.33484: UDP, length 32
05:46:03.211424 IP 172.31.25.24.34365 > 155.246.21.100.33485: UDP, length 32
05:46:03.211457 IP 172.31.25.24.58604 > 155.246.21.100.33486: UDP, length 32
05:46:03.211489 IP 172.31.25.24.45728 > 155.246.21.100.33487: UDP, length 32
05:46:03.211521 IP 172.31.25.24.54598 > 155.246.21.100.33488: UDP, length 32
05:46:03.211598 IP 172.31.25.24.50037 > 172.31.0.2.domain: 42033+ PTR? 34.151.246.155.in-addr.arpa. (45)
05:46:03.217540 IP 155.246.151.34 > 172.31.25.24: ICMP time exceeded in-transit, length 68
05:46:03.217837 IP 155.246.151.34 > 172.31.25.24: ICMP time exceeded in-transit, length 68
05:46:03.219073 IP 155.246.151.90 > 172.31.25.24: ICMP time exceeded in-transit, length 36
05:46:03.219096 IP 155.246.21.100 > 172.31.25.24: ICMP host 155.246.21.100 unreachable - admin prohibited, length 68
05:46:03.219190 IP 155.246.21.100 > 172.31.25.24: ICMP host 155.246.21.100 unreachable - admin prohibited, length 68
05:46:03.219192 IP 155.246.21.100 > 172.31.25.24: ICMP host 155.246.21.100 unreachable - admin prohibited, length 68
05:46:03.219194 IP 155.246.21.100 > 172.31.25.24: ICMP host 155.246.21.100 unreachable - admin prohibited, length 68
05:46:03.219196 IP 155.246.21.100 > 172.31.25.24: ICMP host 155.246.21.100 unreachable - admin prohibited, length 68
05:46:03.219198 IP 155.246.21.100 > 172.31.25.24: ICMP host 155.246.21.100 unreachable - admin prohibited, length 68
05:46:03.219325 IP 155.246.151.90 > 172.31.25.24: ICMP time exceeded in-transit, length 36
05:46:03.219327 IP 155.246.151.90 > 172.31.25.24: ICMP time exceeded in-transit, length 36
05:46:03.235901 IP 172.31.0.2.domain > 172.31.25.24.50037: 42033 NXDomain 0/1/0 (119)
05:46:03.236112 IP 172.31.25.24.38354 > 155.246.21.100.33489: UDP, length 32
05:46:03.236238 IP 172.31.25.24.59301 > 172.31.0.2.domain: 40227+ PTR? 90.151.246.155.in-addr.arpa. (45)
05:46:03.246627 IP 172.31.0.2.domain > 172.31.25.24.59301: 40227 NXDomain 0/1/0 (119)
05:46:03.246858 IP 172.31.25.24.33678 > 172.31.0.2.domain: 44089+ PTR? 100.21.246.155.in-addr.arpa. (45)
05:46:03.330618 IP 172.31.0.2.domain > 172.31.25.24.33678: 44089 2/0/0 PTR stevens.edu., PTR redirect.stevens.edu. (93)
